{
  "schema": "egohygiene.public-site-surface-registry/v1",
  "version": "1.0.0-alpha.1",
  "status": "proposed",
  "owner": "egohygiene/hygiene",
  "updated": "2026-09-21",
  "purpose": "Define stable public-site surface identities, scope-specific canonical routes, aliases, applicability, ownership, evidence, and truthful publication state without copying implementations.",
  "requirements": [
    "required",
    "recommended",
    "optional"
  ],
  "applicability_states": [
    "applicable",
    "not_applicable",
    "unknown"
  ],
  "applicability_rules": [
    "always",
    "site-declared"
  ],
  "implementation_states": [
    "unknown",
    "missing",
    "planned",
    "blocked",
    "implemented",
    "unsupported",
    "not_applicable"
  ],
  "publication_states": [
    "unknown",
    "unpublished",
    "preview",
    "published",
    "withdrawn",
    "not_applicable"
  ],
  "freshness_states": [
    "current",
    "stale",
    "unknown",
    "not_applicable"
  ],
  "assertions": [
    "authoritative",
    "inferred",
    "unknown"
  ],
  "visibilities": [
    "public",
    "internal",
    "private"
  ],
  "dispositions": [
    "owned",
    "inherited",
    "omitted"
  ],
  "site_classes": [
    "application",
    "commerce",
    "content",
    "documentation",
    "hybrid"
  ],
  "route_profiles": [
    {
      "id": "organization",
      "description": "Organization-wide site whose control-plane modules use first-class top-level routes."
    },
    {
      "id": "repository",
      "description": "Repository-owned site whose Repository Intelligence modules remain nested under /intelligence/."
    }
  ],
  "dependency_policy": {
    "meaning": "publication-prerequisite",
    "binding": "route-profile",
    "published_requires_published_dependencies": true
  },
  "route_policy": {
    "canonical_routes_are_absolute": true,
    "directory_routes_use_trailing_slash": true,
    "aliases_are_redirects_only": true,
    "aliases_must_not_publish_duplicate_canonical_content": true,
    "query_and_fragment_routes_forbidden": true
  },
  "surfaces": [
    {
      "id": "accessibility",
      "title": "Accessibility",
      "description": "Accessibility statement, supported accommodations, known limitations, and contact path.",
      "route_bindings": {
        "organization": {
          "canonical_route": "/accessibility/",
          "aliases": []
        },
        "repository": {
          "canonical_route": "/accessibility/",
          "aliases": []
        }
      },
      "applicability_rule": "site-declared",
      "default_requirement": "recommended",
      "site_class_overrides": {
        "application": "recommended",
        "commerce": "recommended",
        "content": "recommended",
        "documentation": "recommended",
        "hybrid": "recommended"
      },
      "default_owner": "repository",
      "source_artifact_kind": "repository-policy",
      "renderer_contract": "site-owned",
      "dependencies": {
        "organization": [],
        "repository": []
      },
      "related_contracts": [
        "egohygiene.agent-ready-web-profile/v1",
        "egohygiene.repository-presentation-profile/v1"
      ]
    },
    {
      "id": "audits",
      "title": "Audits",
      "description": "Audit runs, findings, evidence, and bounded disposition without collapsing independent domains into one score.",
      "route_bindings": {
        "organization": {
          "canonical_route": "/audits/",
          "aliases": [
            "/intelligence/audits/"
          ]
        },
        "repository": {
          "canonical_route": "/intelligence/audits/",
          "aliases": [
            "/audits/"
          ]
        }
      },
      "applicability_rule": "site-declared",
      "default_requirement": "optional",
      "site_class_overrides": {
        "application": "optional",
        "commerce": "optional",
        "content": "optional",
        "documentation": "optional",
        "hybrid": "recommended"
      },
      "default_owner": "repository",
      "source_artifact_kind": "operational-evidence",
      "renderer_contract": "relay-compatible",
      "dependencies": {
        "organization": [],
        "repository": [
          "intelligence"
        ]
      },
      "related_contracts": [
        "egohygiene.repository-intelligence/v1"
      ]
    },
    {
      "id": "blog",
      "title": "Blog",
      "description": "Repository- or organization-owned chronological articles with canonical URLs and explicit provenance.",
      "route_bindings": {
        "organization": {
          "canonical_route": "/blog/",
          "aliases": []
        },
        "repository": {
          "canonical_route": "/blog/",
          "aliases": []
        }
      },
      "applicability_rule": "site-declared",
      "default_requirement": "optional",
      "site_class_overrides": {
        "application": "optional",
        "commerce": "optional",
        "content": "recommended",
        "documentation": "optional",
        "hybrid": "recommended"
      },
      "default_owner": "repository",
      "source_artifact_kind": "repository-content",
      "renderer_contract": "site-owned",
      "dependencies": {
        "organization": [],
        "repository": []
      },
      "related_contracts": [
        "egohygiene.agent-ready-web-profile/v1"
      ]
    },
    {
      "id": "community",
      "title": "Community",
      "description": "Community participation paths and conduct boundaries that do not fabricate an active community.",
      "route_bindings": {
        "organization": {
          "canonical_route": "/community/",
          "aliases": []
        },
        "repository": {
          "canonical_route": "/community/",
          "aliases": []
        }
      },
      "applicability_rule": "site-declared",
      "default_requirement": "optional",
      "site_class_overrides": {
        "application": "optional",
        "commerce": "optional",
        "content": "optional",
        "documentation": "optional",
        "hybrid": "optional"
      },
      "default_owner": "repository",
      "source_artifact_kind": "repository-policy",
      "renderer_contract": "site-owned",
      "dependencies": {
        "organization": [],
        "repository": []
      },
      "related_contracts": [
        "egohygiene.repository-presentation-profile/v1"
      ]
    },
    {
      "id": "compare",
      "title": "Compare",
      "description": "Scoped comparison of compatible Repository Intelligence snapshots with uncertainty preserved.",
      "route_bindings": {
        "organization": {
          "canonical_route": "/intelligence/compare/",
          "aliases": [
            "/compare/"
          ]
        },
        "repository": {
          "canonical_route": "/intelligence/compare/",
          "aliases": [
            "/compare/"
          ]
        }
      },
      "applicability_rule": "site-declared",
      "default_requirement": "optional",
      "site_class_overrides": {
        "application": "optional",
        "commerce": "optional",
        "content": "optional",
        "documentation": "optional",
        "hybrid": "optional"
      },
      "default_owner": "repository",
      "source_artifact_kind": "repository-intelligence",
      "renderer_contract": "relay-compatible",
      "dependencies": {
        "organization": [
          "intelligence"
        ],
        "repository": [
          "intelligence"
        ]
      },
      "related_contracts": [
        "egohygiene.repository-intelligence/v1"
      ]
    },
    {
      "id": "dashboard",
      "title": "Dashboard",
      "description": "Legacy Repository Intelligence analytics compatibility view retained as a distinct, evidence-backed surface.",
      "route_bindings": {
        "organization": {
          "canonical_route": "/intelligence/dashboard/",
          "aliases": [
            "/dashboard/"
          ]
        },
        "repository": {
          "canonical_route": "/intelligence/dashboard/",
          "aliases": [
            "/dashboard/"
          ]
        }
      },
      "applicability_rule": "site-declared",
      "default_requirement": "optional",
      "site_class_overrides": {
        "application": "optional",
        "commerce": "optional",
        "content": "optional",
        "documentation": "optional",
        "hybrid": "optional"
      },
      "default_owner": "repository",
      "source_artifact_kind": "repository-intelligence",
      "renderer_contract": "relay-compatible",
      "dependencies": {
        "organization": [
          "intelligence"
        ],
        "repository": [
          "intelligence"
        ]
      },
      "related_contracts": [
        "egohygiene.repository-intelligence/v1"
      ]
    },
    {
      "id": "decisions",
      "title": "Decisions",
      "description": "Architecture-decision lineage, status, approval, impact, and evidence derived from canonical ADR sources.",
      "route_bindings": {
        "organization": {
          "canonical_route": "/decisions/",
          "aliases": [
            "/adr/",
            "/intelligence/decisions/"
          ]
        },
        "repository": {
          "canonical_route": "/intelligence/decisions/",
          "aliases": [
            "/adr/",
            "/decisions/"
          ]
        }
      },
      "applicability_rule": "site-declared",
      "default_requirement": "optional",
      "site_class_overrides": {
        "application": "optional",
        "commerce": "optional",
        "content": "optional",
        "documentation": "recommended",
        "hybrid": "recommended"
      },
      "default_owner": "repository",
      "source_artifact_kind": "repository-intelligence",
      "renderer_contract": "relay-compatible",
      "dependencies": {
        "organization": [],
        "repository": [
          "intelligence"
        ]
      },
      "related_contracts": [
        "egohygiene.architecture-decision/v1",